{
  "schema_version": 1,
  "id": "mobile-platform-execution",
  "class": "execution",
  "assertion": "A snapshot-bound mobile provider can execute structured launch, wait, and capture actions on the exact configured device and app build.",
  "scope": {
    "task_id": "MOBILE-ANDROID-PREFLIGHT",
    "driver": "platform-automation",
    "provider": "android-emulator",
    "device_id": "emulator-5554",
    "platform_version": "android-35"
  },
  "population_authority": "none",
  "required_policy_ids": [
    "allow-mobile-android-preflight-v1"
  ],
  "required_oracle_ids": [
    "mobile-completed-v1"
  ],
  "required_metric_ids": [],
  "requires_calibration": false,
  "evidence_requirements": [
    "source-manifest",
    "execution-receipt",
    "task-result",
    "trajectory",
    "policy-decisions",
    "oracle",
    "cleanup"
  ]
}
