{
  "schema_version": 1,
  "id": "terminal-pty-execution",
  "class": "execution",
  "assertion": "The deterministic PTY adapter completes the exact darwin prompt, resize, input, alternate-screen, transcript, oracle, and cleanup fixture.",
  "scope": {
    "task_id": "TERMINAL-PTY-SMOKE",
    "driver": "pty",
    "provider": "node-pty@1.1.0",
    "platform": "darwin",
    "dimensions": "80x24-to-100x30"
  },
  "population_authority": "none",
  "required_policy_ids": [
    "allow-terminal-pty-smoke-spawn-v1",
    "allow-terminal-pty-smoke-steps-v1"
  ],
  "required_oracle_ids": [
    "terminal-completed-v1"
  ],
  "required_metric_ids": [],
  "requires_calibration": false,
  "evidence_requirements": [
    "source-manifest",
    "execution-receipt",
    "task-result",
    "trajectory",
    "policy-decisions",
    "oracle",
    "cleanup"
  ]
}
